<?xml version="1.0" encoding="UTF-8"?>
<!DOCTYPE neuralNetwork SYSTEM "NeuralNetwork.dtd">
<neuralNetwork xmlns:xlink="http://www.w3.org/1999/xlink" translator="Translator.xml">
  <teacher class="com.weighscore.neuro.EmpiricTeacher">
    <parameter name="learnRate">0.4</parameter>
    <parameter name="momentumCoefficient">0.2</parameter>
  </teacher>
  <neuron input="true">
    <axon>
      <synapse xlink:type="locator" xlink:href="#xpointer(/neuralNetwork/neuron[3])"/>
      <synapse xlink:type="locator" xlink:href="#xpointer(/neuralNetwork/neuron[4])"/>
    </axon>
  </neuron>
  <neuron input="true">
    <axon>
      <synapse xlink:type="locator" xlink:href="#xpointer(/neuralNetwork/neuron[3])"/>
      <synapse xlink:type="locator" xlink:href="#xpointer(/neuralNetwork/neuron[4])"/>
    </axon>
  </neuron>
  <neuron>
    <axon>
      <synapse xlink:type="locator" xlink:href="#xpointer(/neuralNetwork/neuron[5])"/>
    </axon>
  </neuron>
  <neuron>
    <axon>
      <synapse xlink:type="locator" xlink:href="#xpointer(/neuralNetwork/neuron[5])"/>
    </axon>
  </neuron>
  <neuron output="true"/>
</neuralNetwork>
